{
  "definitions": {},
  "$schema": "http://json-schema.org/draft-07/schema#",
  "$id": "https://example.com/object1614245601.json",
  "title": "3",
  "type": "object",
  "required": [
    "label",
    "type",
    "observer",
    "cases",
    "inputs",
    "outputs",
    "positions"
  ],
  "properties": {
    "label": {
      "$id": "#root/label",
      "title": "Label",
      "type": "string",
      "default": "",
      "pattern": "^.*$"
    },
    "type": {
      "$id": "#root/type",
      "title": "Type",
      "type": "integer",
      "default": 0
    },
    "observer": {
      "$id": "#root/observer",
      "title": "Observer",
      "type": "object",
      "required": [
        "input",
        "dataType"
      ],
      "properties": {
        "input": {
          "$id": "#root/observer/input",
          "title": "Input",
          "type": "string",
          "default": "",
          "pattern": "^.*$"
        },
        "dateType": {
          "$id": "#root/observer/dataType",
          "title": "Datatype",
          "type": "string",
          "default": "",
          "pattern": "^.*$"
        }
      }
    }
  ,
    "cases": {
      "$id": "#root/cases",
      "title": "Cases",
      "type": "array",
      "default": [],
      "items":{
        "$id": "#root/cases/items",
        "title": "Items",
        "type": "object",
        "required": [
          "guard",
          "type"
        ],
        "properties": {
          "guard": {
            "$id": "#root/cases/items/guard",
            "title": "Guard",
            "type": "string",
            "default": "",
            "pattern": "^.*$"
          },
          "type": {
            "$id": "#root/cases/items/type",
            "title": "Type",
            "type": "string",
            "default": "",
            "pattern": "^.*$"
          }
        }
      }

    },
    "inputs": {
      "$id": "#root/inputs",
      "title": "Inputs",
      "type": "array",
      "default": [],
      "items":{
        "$id": "#root/inputs/items",
        "title": "Items",
        "type": "string",
        "default": "",
        "pattern": "^.*$"
      }
    },
    "outputs": {
      "$id": "#root/outputs",
      "title": "Outputs",
      "type": "array",
      "default": [],
      "items":{
        "$id": "#root/outputs/items",
        "title": "Items",
        "type": "string",
        "default": "",
        "pattern": "^.*$"
      }
    },
    "positions": {
      "$id": "#root/positions",
      "title": "Positions",
      "type": "array",
      "default": [],
      "items":{
        "$id": "#root/positions/items",
        "title": "Items",
        "type": "object",
        "required": [
          "label",
          "x",
          "y",
          "width"
        ],
        "properties": {
          "label": {
            "$id": "#root/positions/items/label",
            "title": "Label",
            "type": "string",
            "default": "",
            "pattern": "^.*$"
          },
          "x": {
            "$id": "#root/positions/items/x",
            "title": "X",
            "type": "number",
            "default": 0
          },
          "y": {
            "$id": "#root/positions/items/y",
            "title": "Y",
            "type": "number",
            "default": 0
          },
          "width": {
            "$id": "#root/positions/items/width",
            "title": "Width",
            "type": "number",
            "default": 0
          }
        }
      }

    }
  }
}
