{
      "label": "AwesomeSelective",
      "type": 3,
      "observer": {
      "input": "valuestream",
      "dataType": "number"
    },
      "cases": [
        {
      "guard": ">=10",
      "label": "Light",
      "type": "onOffComponent"
      },{
      "guard": "<= 9",
      "label": "Lock",
      "type": "onOffComponent"
      }
      ],
      "inputs": [
        "valuestream"
      ],
      "outputs": [
        
      ],
      "positions": [
        {
      "label": "Light",
      "x": 0,
      "y": 0,
      "width": 893
      },{
      "label": "Lock",
      "x": 0,
      "y": 0,
      "width": 893
      }
      ]
    }