{
      "label": "I am Selective",
      "type": 3,
      "observer": {
      "input": "onSelect",
      "dataType": "number"
    },
      "cases": [
        {
      "guard": "<9",
      "type": "Murden"
      },{
      "guard": ">=9",
      "type": "A"
      }
      ],
      "inputs": [
        "onSelect"
      ],
      "outputs": [
        
      ],
      "positions": [
        {
      "label": "Murden",
      "x": 10,
      "y": 10,
      "width": 50
      },{
      "label": "A",
      "x": 10,
      "y": 80,
      "width": 50
      }
      ]
    }